index,bbox,label_id,label_text,content,width,height
0,"[481, 53, 638, 82]",15,SELLER,Gaigon Co.op,1024,1366
1,"[418, 75, 702, 121]",15,SELLER,Co.op Food HN THE K-PARK,1024,1366
2,"[310, 132, 783, 219]",16,ADDRESS,"Tang 1 , SH42 - Toa K3,Cong trinh chung cu ket hop dich vu tren o dat H-CT2 thuoc Du an Dau tu xay dung khu nha o Hi Brand",1024,1366
3,"[398, 221, 728, 250]",16,ADDRESS,"tai khu đô thị moi Văn Phu,",1024,1366
4,"[368, 243, 763, 276]",16,ADDRESS,"P. Phu La, Q. Ha Dong, Tp Ha Noi",1024,1366
5,"[458, 429, 806, 475]",17,TIMESTAMP,Ngày: 20/09/2019 10:25:05,1024,1366
6,"[302, 650, 603, 694]",18,TOTAL_COST,Tong so tien thanh toan:,1024,1366
7,"[669, 645, 809, 689]",18,TOTAL_COST,"48,139.00",1024,1366
